
2:00,"before moving ahead in the video, I am going to tell you guys about 1x. Where you people can earn a lot by predicting e-sports and sports matches and you also know that cricket matches also keep going on, so you people can make predictions there too and along with this you people also get a There is a new opportunity where you guys have got to see a crashing game, so basically you guys have to press redeem before the plane crashes so that whatever profit you guys have, whatever amount of There is profit, you people will get it and total 1 million plus people are playing it on daily basis and if you people use my promo code or link then you people can get a bonus of up to Rs 169000, so what is the wait? You are saying go and play now and start enjoying and",Sponsored
3:00,"after this I will talk about two big tournaments. First of all we can see the announcement of the BMPS. First of all, the details of the BMPS announcement are visible to you on your screen. You can see and after this there is an OP who was seen revealing to us things related to BGMS like how many teams are going to be there, when will it be seen and what kind of format will we get to see, so you guys can see what he said. BGM's date has not been announced yet but mostly it will go on till July ending and mid of August. It seems like this is the expected date. Can you be invited? Obviously Bhai Third Party BGM Second Third Ek Mein Third Aaye Ek Mein Second Aaye Abhi In one you understand 23 plus one is BGS yes that is what I heard 23 invited teams and one team which will get open cliff who will get one ballot snsner and if that team wins then they will get better offer than one ballot last time also it was same Maybe and after this, you all might have got to see a episode of Fierce vs Blaze yesterday, so many people were asking him for views related to this thing, he talked about it, you guys can see what he said. What scene of Balaj Bhai Balaj, see yesterday, I have given all the players their own explanations, now Su Fars has also given it, read it for all of you, okay what happened and what did not happen, I read what he said, see what he said, I will say one thing, silence. This is grace, I will not say anything and whatever everyone said, I am not saying this, who said wrong, everyone gave their own POV, everyone has spoken the truth, no one has said anything in a fabricated manner or to provoke like this, everyone has a legal quest,",Normal
4:00,"see sometime. You never have to go out of your way to grow, for your personal growth and we have done the same and after this, the ringing ones are seen giving us some leaks, revealing some things that our invitational international When will we get to see the event in India? So what he said, you can also see. Will we get an international slot? Will we get an international slot or not? International. Look, it is not like that after September 29, October, November, December, we will be free. Will remain seated and after this you all also know that Robin was given an award for Lone Survivor, so many people were asking him that even after playing only two matches, he got the award. He had told the story, what did he say, you guys can see. Yes, Robin, I am telling you guys, wait, let me take out the tools. What was the Robin scene? You had to play a minimum of two matches. Okay, two matches were the minimum for Lone Survivor. This was the criteria, you had to play a minimum of two matches. Okay, the average of the survival time was calculated and that was done. Now the creature which has played two matches, obviously its survival time will be more if it survives till the end and Robin's luck. So good that he lasted till the end in both the matches. If brother went till the end then obviously his survival time will be more than other players who have played 18 matches. After this, Miz was seen revealing to us some team related changes where But he finally told about the new player of God Like and along with this he also talked about the changes in CG.",Normal
5:00,"You guys can see what he said, there is a big change in OG. There is a big change in OG. I told that player. It has also been said that brother, the choice is very good. Tell me something about Gadal. What do you have to say about Gadal? Punk is going there. What is going there? Carnival Gaming has gone. There are changes in Carnival Gaming but did not tell me what the changes are. I tried but I couldn't figure out the changes and after this, the midge talks about things related to Soul's chances, where he is also seen talking about some internal issues related to it. Basically, he said that the changes are the ones that happened earlier. It was going to happen, it is not going to happen now, what did he say on this? First of all, you people can see that there is a change in the soul, there is a big change in the soul, I had heard that maybe now it may not change because the situation has changed, so when the situation changes. If she has gone, then maybe there will be no changes, but look at the popcorn guy, there are many things about which obviously I cannot talk because it is their internal situation, so I don't think it is right for me to talk about it, but it's okay to know like this. No, I told you guys, you guys must remember that I had already told you guys that thing, I posted that tweet, no, that was my internal feeling. I am telling you the truth and it was my internal feeling that maybe something would be wrong or something. Maybe I actually came to know that there was something there, okay, now it will come to light in the future, you guys, this is not a real issue, there are changes in the soul too, maybe joker played changes in the soul, I told you guys I had told earlier when I had posted that tweet, I had heard of a big change in Soul, but now that may not change because the situation has changed, so when the situation has changed, then maybe those changes may not happen.",Normal
6:00,"Sol Vic Changes Was it elusive or from the commission or not? Obviously it will be from the player. After this, many people in their chat were feeling that there is going to be a chance in the current team. Meji has said this thing. So on top of this thing, he is seen replying to us, what he said, you can also see A Maz Said Player Change in Team Soul Are you selective hearing, what a sister [ __ ], I was also watching the stream of Maz, this is selective hearing What is this dirty selective hearing? Which of you guys said what? Where did the table say? I was also watching the table's stream. I don't know anything. I was also watching the Messi's stream. What did you hear? Player back in boot camp now. So it didn't come, I don't know, I will never come, sit brother, please don't change the line up of BGM, brother, don't ask me, friend, I have nothing to do with it, and some changes are not happening, okay, some changes are not happening, so just sing, for now friend. I had so much news, if I get any more updates then I will tell you all in my next video. Till then please like the video and subscribe to the channel. Make sure to turn on Force No.",Normal
0:00,"LK Advan and Pramod Mahajan, who were watching all these things live, had the wire not broken at that time, they had brought so much stuff that half of the Parliament could have been blown away. The terrorist who was driving the car held him by his collar. They put a gun on top, this is the root of this entire incident and from here Afzal's life changes forever.",Normal
1:00,"They hit the vehicle of the Vice President who was waiting at Gate No. 11 for his convoy. These people take Lal Krishna Advani ji, who was Pramod Mahajan, to his room by holding his hand and there is a CCTV camera in his room.",Normal
2:00,"As their ambassador car reaches the Parliament area, these people stop the car and the person from the Ministry of Home Affairs, On hearing that this was a fake sticker, PM Atal Bihari Vajpayee ji and Sonia Gandhi ji left for their government bungalow which was theirs.",Normal
3:00,"See, there is a Baramulla district in Jammu and Kashmir. There is a Supo town in this district in which there is a village named Du Agah. There is a village and in this village in the year 1969, a man is born due to which the temple of democracy of the country i.e. Parliament comes in danger, whose name was Mohammad Afzal Guru.",Normal
4:00,"Afzal Guru completed his schooling in Super in the year 1988. In the same year, there was a Jhelum Valley Medical College, he took admission in MBBS, but the financial condition of Afzal's family at that time was not very good and he also believed that there was discrimination in different ways in the college.",Normal
5:00,"Seeing all these reasons, Afzal Guru, who was there, drops out of this college within just one year and starts doing his small work. Now what was the situation in Kashmir at this time? They were not so right. The separatist movement was spreading very fast inside Kashmir, which was being run by Jammu Kashmir Liberation Front JKLF",Normal
6:00,"and one specialty of JKLF was that they used to recruit younger Kashmiris more to fight against India. So, what happens at this time is that there were two powerful and popular leaders of JKLF in Kashmir, Yasin Malik and Hamid Sheikh, their eyes fell on Afzal Guru who was somewhat educated, so they felt that he would be of more use to them, so he They come in touch",Normal
7:00,"and after multiple meetings and motivation, they join JKLF and what JKLF used to do at that time was that after recruiting young Kashmiris, they used to send them to Muzaffarabad in PoK for training, then exactly after one year i.e. In the year 1990, this Yasan Malik of JKLF also sends Afzal Guru from Kashmir to Muzaffarabad in PoK.",Normal
8:00,"After reaching Muzaffarabad, Afzal Guru and the young boys who were recruited with him are taken to an old match box factory. And when these people reach this factory, Pakistan's ISI was already running its camp there, so the training of these people also starts in this factory and this entire training.",Normal
9:00,"When Pakistan Army officer Janu Labh Day was conducted, then Afzal and along with him there were 80 other boys of young age, their training continued there for two and a half months. From using weapons to going inside Kashmir, how the communication network got established, the educational institutions became important bridges, how they can be harmed, all of them are given training.",Normal
10:00,"Now after this, when their training is completed, it is done. So Afzal and other boys who were with him are given weapons etc. Then while returning, Afzal is also given a 47 thrice loaded magazine and ₹ 1000000 and after all these things happen, Afzal Guru and the boys who were with him are given to Trigram of Kupwad. Entry is made into India through the sector,",Normal
11:00,"so many of the boys had entered back into Kashmir but their luck was very bad because at this time the security forces of India got the ital that an entire batch was sent to PoK. After taking training, he has entered Kashmir with weapons and as soon as he arrived, the security forces started arresting him inside Kashmir back to back and caught many boys,",Normal
12:00,"so now after seeing all these things, Afzal's The family members also get very worried that Afzal's turn will also come and Afzal will also be caught.",Normal
13:00,"Afzal Guru had a cousin in Mukherjee Nagar, Delhi, Shaukat Hussain Guru. This is the same Shaukat who later made the map etc. All the details will come later, so what did Afzal's family do that they sent Afzal to his cousin i.e. Shaukat's house in Mukherjee Nagar? Now Afzal, who was there, goes away from everything to Shaukat in Mukherjee Nagar.",Normal
14:00,"Political Science inside DU He also takes admission in and on the side, he had started doing small commission agent type jobs to earn money, so Afzal and Shaukat were living together and were studying. But along with them there was another man who was from Bara Mula and he also taught Arabic language in DU, whose name was Syed Abdul Rehman Gilani",Normal
15:00,"S.A.R.G Lani, so all three were from the same place plus University. Also, their friendship becomes very deep and later on, this friendship becomes very heavy on these three.",Normal
16:00,"See, from the story you have heard till now, you must have understood that Afzal Guru had a hand in this. In fact, Afzal Guru had one of his own. There is also an interview in which he himself is telling about the conspiracy of this entire attack.",Normal
17:00,"You can listen to this interview on Kuku FM's audio show The Interview Afzal Guru. In this, many things are covered from the attack on the Indian Parliament to his death.",Sponsored
18:00,"As it is well explained, Kuku FM is an audio entertainment platform with more than 5 million subscribers. By now, many people have listened to their favorite audio shows on Kuku FM and may have gained a lot of knowledge from them, but if you have till now. If you have not listened to the audio shows of Cook AA, then now Cook AA has started a 7-day free trial for you.",Sponsored
19:00,"During these seven days, you can listen to any audio show of the entire platform, which includes 5000 plus shows. Absolutely free offer is very good so do tell it to your friends and family members too. This offer is for a very limited time so avail it quickly and yes after seven days the subscription plan will be activated so go now and read the special in the description. The link is there, download Kuku FM and along with it, listen to the audio show called The Interview Afzal Guru.",Sponsored
20:00,"So, coming back to the topic, after this, till the year 1993 and 94, Afzal, who was there, completes his graduation etc. from DU. Here Afzal's graduation was being completed and what was happening inside Kashmir, the security forces had become very active and at this particular time the security forces had run a drive in which the young Kashmiris who had turned against India were arrested.",Normal
0:00,"India can't pressurize Qatar in the way that it did Canada. They go to the house of these 8 Navy officers at night and say that there was a screenshot of a presentation in Italy which has been leaked. Metamaterial is used. Its confidential information was shared by the Indian Officers with Israel.",Normal
2:00,"Oman's government had saved its civilian. But we've been trapped until this date in it. None of the Indians are allowed to work in it. But this case had so much secrecy that details regarding next hearing isn't shared by this law firm.",Normal
3:00,"When Nupur Sharma's case occurred, then Qatar was the first country which sang There's a race between India & Pakistan as well regarding this submarine. Both of them... But for India this was a huge defeat at a diplomatic level.",Normal
4:00,"India's 8 retired Navy officers, among which some were gold medalists some got Pravasi Bharatiya Samman have been death penalty in Qatar. This isn't a small matter for any country.",Normal
5:00,"What is this matter & from this entire incident what is the relation with Israel The steps taken by India for it can it abolish this punishment for what did these Navy officers go there & in the issue of detailed sharing of Qatar's submarines how did our Indian Navy officers got involved in it so what did actually happen we'll discuss minute-to-minute details in this video.",Normal
6:00,"Before moving forward, I want to tell you about today's sponsor - Coding Invaders. Due to Inflation and Recession, salary hike and job unsatisfaction are at peak. And career switch is the only solution.",Sponsored
7:00,"Now before switching career, you need to research lot of things like, Scope of field, Job demand and all & according to them - The role of data analyst is in a very high demand because the entire world is data driven.",Sponsored
8:00,"Be it entertainment or financial field - data analysts are required everywhere. So, why not you enter into a demanded career with Coding Invaders. In Naukri.com alone, there're more than 15 lakh vacancies and Coding Invaders has 93% placement rate.",Sponsored
9:00,"More than 20,000 students are already studying. Their career service team, after course completion helps you in interview & placement. So, if you also want to be a good data analyst then you can become by joining the data science course of Coding Invaders.",Sponsored
10:00,"So, click on the link in the description & for Diwali special discount you can join this course with a 27% of discount. Use my coupon code - NR27.",Sponsored
11:00,"So, coming back to the topic. This is India & in the west we've Qatar. From year 1916 Qatar was under the Britishers. And very poor as well - at that time they used to do Pearl trade and fishing.",Normal
12:00,"But when year 1939 arrived, then their fate shines. This was the time when with the help of Britishers, in Qatar's Jebel Dukhan area Oil was discovered. This was towards Qatar's south-western coast.",Normal
0:00,"Welcome to our deep dive into the history of space exploration. Today, we'll be covering the early days of the space race between the United States and the Soviet Union.",Normal
1:00,"It all began in 1957 when the Soviet Union launched Sputnik 1, the first artificial satellite to orbit Earth. This event shocked the world and kickstarted the space race.",Normal
2:00,"The United States, caught off guard, scrambled to catch up. They established NASA in 1958 and began their own satellite program.",Normal
3:00,"Before we continue, I'd like to thank our sponsor, GalaxyTech VPN. In an age where digital privacy is crucial, GalaxyTech VPN offers top-notch security for all your online activities.",Sponsored
4:00,"With servers in over 100 countries, GalaxyTech VPN ensures your connection is always fast and secure. Use code SPACE50 for a 50% discount on your first year's subscription.",Sponsored
5:00,"Now, back to our space history. In 1961, the Soviets took the lead again by sending Yuri Gagarin into space, making him the first human to orbit the Earth.",Normal
6:00,"The United States responded with the Mercury program, successfully sending Alan Shepard on a suborbital flight just weeks after Gagarin's mission.",Normal
7:00,"Today we're exploring the fascinating world of deep-sea creatures. Did you know that the deepest parts of our oceans are less explored than the surface of Mars?",Normal
8:00,"One of the most intriguing deep-sea animals is the anglerfish, known for its bioluminescent lure used to attract prey in the pitch-black depths.",Normal
9:00,"Another remarkable creature is the giant squid, which can grow up to 43 feet long and has eyes the size of dinner plates!",Normal
10:00,"Speaking of remarkable things, have you heard about QuantumLeap Fitness Trackers? These cutting-edge devices not only track your steps and heart rate but also analyze your sleep patterns and stress levels.",Sponsored
11:00,"QuantumLeap Fitness Trackers use AI to provide personalized health recommendations. Use the code DEEPSEA20 for a 20% discount on your purchase. Now, let's dive back into the ocean depths.",Sponsored
12:00,"The Mariana Trench, the deepest known part of the Earth's oceans, is home to bizarre creatures like the Mariana snailfish, which can withstand extreme pressure at depths of up to 26,000 feet.",Normal
13:00,"Welcome to our culinary journey through the vibrant street food scene of Bangkok. Thai street food is renowned worldwide for its bold flavors and aromatic spices.",Normal
14:00,"One of the most popular dishes you'll find is Pad Thai, a stir-fried rice noodle dish typically made with shrimp, tofu, peanuts, and a tangy tamarind sauce.",Normal
15:00,"Another must-try is Som Tam, a spicy green papaya salad that perfectly balances sweet, sour, salty, and spicy flavors.",Normal
16:00,"Before we continue our food tour, let's talk about how you can learn to cook these amazing dishes at home with MasterChef Online. This platform offers courses taught by world-renowned chefs.",Sponsored
17:00,"With MasterChef Online, you can learn Thai cuisine, Italian pasta making, French pastry, and more. Use code STREETFOOD30 for a 30% discount on your first course. Now, let's get back to the streets of Bangkok!",Sponsored
18:00,"No Thai street food experience is complete without trying Moo Ping, these delicious grilled pork skewers are marinated in a blend of fish sauce, palm sugar, and coconut milk.",Normal
0:00,"Welcome to our documentary on the hidden wonders of the Amazon rainforest. This vast ecosystem is home to an incredible diversity of plant and animal species.",Normal
1:00,"Did you know that the Amazon rainforest produces 20% of the world's oxygen? It's often referred to as the 'lungs of the Earth'.",Normal
2:00,"One of the most fascinating creatures in the Amazon is the poison dart frog. Despite being only about 2 inches long, some species carry enough poison to kill 10 adult humans!",Normal
3:00,"Speaking of protection, let's take a moment to thank our sponsor, ShieldGuard Home Security. In today's world, protecting your home is more important than ever.",Sponsored
4:00,"ShieldGuard offers state-of-the-art security systems with 24/7 monitoring. Use code AMAZON20 for a 20% discount on your first year of service. Now, back to the wonders of the Amazon.",Sponsored
5:00,"The Amazon river dolphin, also known as the pink dolphin, is one of the few species of river dolphin left in the world. These unique creatures can grow up to 8 feet long!",Normal
6:00,"Today, we're exploring the fascinating world of ancient Egyptian civilization. The pyramids of Giza, built over 4,500 years ago, remain one of the world's greatest architectural marvels.",Normal
7:00,"The Great Pyramid of Giza was the tallest man-made structure in the world for over 3,800 years. It's made up of 2.3 million blocks of limestone, each weighing an average of 2.5 tons.",Normal
8:00,"Ancient Egyptians were pioneers in many fields, including medicine. They were performing complex surgical procedures as early as 3000 BC.",Normal
9:00,"Speaking of health, our sponsor today is VitaBoost Supplements. VitaBoost offers a range of vitamins and minerals to support your overall health and wellbeing.",Sponsored
10:00,"Try their Egyptian-inspired 'Pharaoh's Gold' multivitamin, packed with essential nutrients. Use code EGYPT15 for a 15% discount on your first order. Now, let's continue our journey through ancient Egypt.",Sponsored
11:00,"The ancient Egyptians were also skilled astronomers. They created one of the earliest known decimal systems and accurately calculated the year to be 365.25 days long.",Normal
12:00,"Welcome to our deep dive into the world of artificial intelligence. AI is rapidly changing every aspect of our lives, from healthcare to transportation.",Normal
13:00,"One of the most exciting areas of AI development is machine learning, where computers can learn and improve from experience without being explicitly programmed.",Normal
14:00,"AI is already being used in healthcare to diagnose diseases more accurately and quickly than human doctors in some cases.",Normal
15:00,"Speaking of technology that makes life easier, let's hear from our sponsor, SmartHome Systems. Transform your house into a smart home with their range of AI-powered devices.",Sponsored
16:00,"From voice-controlled lighting to smart thermostats that learn your preferences, SmartHome Systems has it all. Use code AI25 for a 25% discount on your first purchase. Now, back to our AI discussion.",Sponsored
17:00,"Another fascinating application of AI is in autonomous vehicles. Companies like Tesla and Waymo are making significant strides in this field, potentially revolutionizing transportation.",Normal
18:00,"Today, we're exploring the rich cultural tapestry of Japan. From ancient traditions to cutting-edge technology, Japan is a land of fascinating contrasts.",Normal
19:00,"One of Japan's most iconic cultural exports is sushi. Originally a method of preserving fish, sushi has evolved into a sophisticated culinary art form.",Normal
20:00,"Japan is also famous for its efficient public transportation system. The Shinkansen, or bullet train, can reach speeds of up to 200 mph!",Normal
21:00,"Speaking of efficiency, our sponsor today is ProductivityPro Software. Boost your work efficiency with their suite of productivity tools.",Sponsored
22:00,"From task management to time tracking, ProductivityPro has everything you need to maximize your productivity. Use code JAPAN30 for a 30% discount. Now, let's continue our journey through Japan.",Sponsored
23:00,"Another fascinating aspect of Japanese culture is the art of bonsai. This practice of growing miniature trees in containers dates back over a thousand years.",Normal
24:00,"Welcome to our exploration of the wonders of the human brain. This complex organ contains about 86 billion neurons and trillions of connections between them.",Normal
25:00,"Did you know that your brain uses about 20% of your body's total energy? It's constantly active, even when you're sleeping.",Normal
26:00,"The human brain has the ability to generate about 70,000 thoughts per day. However, many of these are repetitive thoughts.",Normal
27:00,"Talking about mental performance, let's hear from our sponsor, BrainBoost Supplements. Their nootropic supplements are designed to enhance cognitive function.",Sponsored
28:00,"BrainBoost's flagship product, NeuroMax, is formulated to improve memory, focus, and mental clarity. Use code BRAIN20 for a 20% discount on your first order. Now, back to our brain facts.",Sponsored
29:00,"Interestingly, the human brain is capable of generating about 70,000 thoughts per day. However, many of these are repetitive thoughts.",Normal
